{
  "$schema": "https://3webobs.com/schemas/intents.json",
  "version": "1.2",
  "generated": "2026-08-25",
  "service": {
    "name": "3webs",
    "domain": "https://3webobs.com/",
    "operator": "AIVENTURE S.R.L."
  },
  "purpose": "Declares the tasks that 3webs can perform and the Machine Web / A2A intent vocabulary that 3webs can observe, classify and evaluate on public machine-facing interfaces.",
  "interpretation": {
    "intent_is_capability_proof": false,
    "intent_vocabulary_is_service_capability": false,
    "statement": "A declared intent describes a requested or advertised machine action. Its presence does not by itself prove that the corresponding capability is reachable, invocable or operational.",
    "capability_states": [
      "declared",
      "valid",
      "reachable",
      "invocable",
      "verified"
    ]
  },
  "service_intents": [
    {
      "id": "observe_once",
      "name": "Observe a domain once",
      "description": "Perform a point-in-time observation of publicly accessible evidence for a domain.",
      "utterances": [
        "audit this website",
        "observe this website",
        "observe this domain",
        "how visible is this domain to AI",
        "check this site's AI visibility",
        "check my AI readiness",
        "what do AI systems see on this site",
        "what does a crawler see on this website",
        "check the human web, AI web and machine web for this domain"
      ],
      "capability": "obs.one_shot",
      "input": {
        "required": [
          "url"
        ],
        "optional": []
      },
      "output": {
        "type": "observation",
        "description": "Point-in-time evidence and signal results for the submitted public domain."
      },
      "commercial": {
        "pricing": "See current service terms.",
        "terms": "https://3webobs.com/terms.html"
      }
    },
    {
      "id": "observe_permanent",
      "name": "Observe a domain continuously",
      "description": "Re-observe a public domain over time and detect material changes in observable signals.",
      "utterances": [
        "monitor this domain",
        "monitor this website",
        "watch this domain",
        "watch for regressions",
        "tell me when something changes",
        "tell me when my score drops",
        "keep observing this website",
        "track changes in AI visibility",
        "monitor the human web, AI web and machine web"
      ],
      "capability": "obs.permanent",
      "input": {
        "required": [
          "url",
          "interval"
        ],
        "optional": [
          "change_threshold"
        ]
      },
      "output": {
        "type": "observation_series",
        "description": "A sequence of observations and detected changes over time."
      },
      "commercial": {
        "pricing": "See current service terms.",
        "terms": "https://3webobs.com/terms.html"
      }
    },
    {
      "id": "compare_before_after",
      "name": "Compare two observations",
      "description": "Compare a current observation with an identified baseline observation and report the observable delta.",
      "utterances": [
        "did my changes work",
        "compare before and after",
        "compare these observations",
        "what changed since my last observation",
        "show the delta since last month",
        "did my AI visibility improve",
        "which signals changed"
      ],
      "capability": "obs.diff",
      "input": {
        "required": [
          "url",
          "baseline_id"
        ],
        "optional": []
      },
      "output": {
        "type": "observation_diff",
        "description": "Signal-level differences between the baseline and current observation."
      }
    },
    {
      "id": "explain_signal",
      "name": "Explain a signal result",
      "description": "Return the observable evidence and evaluation rationale for a specific signal.",
      "utterances": [
        "why did this signal fail",
        "why did this signal pass",
        "why is this signal partial",
        "why is this signal unverified",
        "what evidence did you find",
        "show me the evidence for this signal",
        "explain the llms.txt result",
        "explain this score"
      ],
      "capability": "obs.explain",
      "input": {
        "required": [
          "url",
          "signal_id"
        ],
        "optional": [
          "observation_id"
        ]
      },
      "output": {
        "type": "signal_explanation",
        "description": "Signal state, test method, observable evidence and explanation."
      }
    },
    {
      "id": "list_signals",
      "name": "List the signal catalogue",
      "description": "Return the current 3webs observation signal catalogue and associated metadata.",
      "utterances": [
        "what do you measure",
        "show me the 167 signals",
        "list the signals",
        "show the signal catalogue",
        "what is in the methodology",
        "what does 3webs test",
        "which SEO AEO GEO AIO and AI signals do you measure"
      ],
      "capability": "obs.catalogue",
      "input": {
        "required": [],
        "optional": [
          "discipline",
          "web_layer"
        ]
      },
      "output": {
        "type": "signal_catalogue",
        "description": "Current signal definitions and available methodological metadata."
      }
    }
  ],
  "machine_web_intent_vocabulary": {
    "namespace": "agent",
    "range": "36-50",
    "count": 15,
    "purpose": "Machine Web and A2A intent vocabulary used by 3webs to identify, classify and describe agent capabilities observed on public machine-facing interfaces.",
    "important": "These intents describe capabilities that 3webs may observe on another domain or agent. Their inclusion does not mean that 3webs itself performs these actions.",
    "intents": [
      {
        "number": 36,
        "id": "agent.discover",
        "name": "Discover agent",
        "human_request": "Find an agent that can compare flights.",
        "expected_machine_behavior": "Discover one or more agents whose declared or verified capabilities match the requested task.",
        "example_response": "Found FlightSearch, an agent declaring flight search and comparison capabilities."
      },
      {
        "number": 37,
        "id": "agent.capability_check",
        "name": "Check agent capability",
        "human_request": "Can this agent make reservations?",
        "expected_machine_behavior": "Inspect the agent's declared capability, applicable policy, constraints, reachability and confirmation requirements.",
        "example_response": "The agent declares reservation capability and requires human confirmation before execution."
      },
      {
        "number": 38,
        "id": "agent.delegate",
        "name": "Delegate task",
        "human_request": "Send the hotel search to the specialized agent.",
        "expected_machine_behavior": "Delegate a defined task to another compatible agent and return a task identifier or execution state.",
        "example_response": "Task delegated. Status: working."
      },
      {
        "number": 39,
        "id": "agent.orchestrate",
        "name": "Orchestrate agents",
        "human_request": "Organize a complete trip.",
        "expected_machine_behavior": "Coordinate multiple agents or capabilities toward a shared higher-level objective.",
        "example_response": "Coordinating flight, accommodation and local transport capabilities."
      },
      {
        "number": 40,
        "id": "agent.parallelize",
        "name": "Parallelize tasks",
        "human_request": "Search for the flight, hotel and transfer simultaneously.",
        "expected_machine_behavior": "Create independent subtasks that may execute concurrently.",
        "example_response": "Three independent subtasks were created for parallel execution."
      },
      {
        "number": 41,
        "id": "agent.plan_execute",
        "name": "Plan and execute",
        "human_request": "Plan and execute the equipment purchase.",
        "expected_machine_behavior": "Create an execution plan, identify approval boundaries and execute only actions permitted by policy.",
        "example_response": "The plan is prepared. Purchase execution requires human approval."
      },
      {
        "number": 42,
        "id": "agent.request_quote",
        "name": "Request quote",
        "human_request": "Request quotes from three agents.",
        "expected_machine_behavior": "Request structured commercial proposals from compatible providers or agents.",
        "example_response": "Three quote requests were submitted; two responses have been received."
      },
      {
        "number": 43,
        "id": "agent.negotiate",
        "name": "Negotiate",
        "human_request": "Try to obtain a better price.",
        "expected_machine_behavior": "Conduct negotiation within explicitly declared authority, policy and economic boundaries.",
        "example_response": "A 10% discount was requested; the provider countered with 5%."
      },
      {
        "number": 44,
        "id": "agent.validate_result",
        "name": "Validate result",
        "human_request": "Verify the result received from the agent.",
        "expected_machine_behavior": "Evaluate the returned result against available evidence, provenance, constraints or independent sources.",
        "example_response": "The result was validated against available evidence; two independent sources support the principal claims."
      },
      {
        "number": 45,
        "id": "agent.request_human",
        "name": "Request human intervention",
        "human_request": "Ask for my approval before payment.",
        "expected_machine_behavior": "Pause execution at a defined human-oversight boundary and request explicit authorization.",